{
  "$schema": "./sources.schema.json",
  "generated": null,
  "note": "Curated registry of third-party material for the .NET 10/11 workshop. Core workshop content is derived from Microsoft Learn; entries here are an enrichment layer only. See inbox/README.md for the intake and vetting pipeline, including the copyright usage tiers.",
  "modules": [
    {
      "id": "day1-m1",
      "day": 1,
      "title": "Platform, runtime & tooling"
    },
    {
      "id": "day1-m2",
      "day": 1,
      "title": "C# 14 language"
    },
    {
      "id": "day1-m3",
      "day": 1,
      "title": ".NET 10 libraries (PQC, System.Text.Json)"
    },
    {
      "id": "day1-m4",
      "day": 1,
      "title": "ASP.NET Core 10 (OpenAPI 3.1)"
    },
    {
      "id": "day1-m5",
      "day": 1,
      "title": "EF Core 10"
    },
    {
      "id": "day1-m6",
      "day": 1,
      "title": "Wrap-up & adoption checklist"
    },
    {
      "id": "day2-m1",
      "day": 2,
      "title": ".NET 11 runtime & runtime-native async"
    },
    {
      "id": "day2-m2",
      "day": 2,
      "title": "C# 15 language (unions, closed hierarchies)"
    },
    {
      "id": "day2-m3",
      "day": 2,
      "title": ".NET 11 libraries"
    },
    {
      "id": "day2-m4",
      "day": 2,
      "title": "ASP.NET Core 11 (OpenAPI 3.2)"
    },
    {
      "id": "day2-m5",
      "day": 2,
      "title": "EF Core 11"
    },
    {
      "id": "day2-m6",
      "day": 2,
      "title": ".NET 12 outlook & adoption decision"
    }
  ],
  "sources": [
    {
      "id": "milanjovanovic-named-query-filters-ef10",
      "title": "Named Query Filters in EF 10 (multiple query filters per entity)",
      "author": "Milan Jovanović",
      "publisher": "milanjovanovic.tech",
      "url": "https://milanjovanovic.tech/blog/named-query-filters-in-ef-10-multiple-query-filters-per-entity",
      "published": "2025-07-26",
      "retrieved": "2026-09-14",
      "origin": "discovered",
      "kind": "article",
      "modules": [
        "day1-m5"
      ],
      "covers": [
        "net10",
        "efcore",
        "efcore10",
        "query-filters",
        "soft-delete",
        "multi-tenancy"
      ],
      "verification": "verified",
      "usageTier": 1,
      "summary": "Shows why one global filter per entity was never enough once soft-delete and tenant scoping collide, and walks the EF 10 replacement where each filter is named and can be switched off independently. The most practical treatment of the feature our EF Core module leads with.",
      "recommended": true
    },
    {
      "id": "timdeschryver-named-global-query-filters-ef10",
      "title": "Named global query filters in Entity Framework Core 10",
      "author": "Tim Deschryver",
      "publisher": "timdeschryver.dev",
      "url": "https://timdeschryver.dev/blog/named-global-query-filters-in-entity-framework-core-10",
      "published": "2025-12-04",
      "retrieved": "2026-09-14",
      "origin": "discovered",
      "kind": "article",
      "modules": [
        "day1-m5"
      ],
      "covers": [
        "net10",
        "efcore",
        "efcore10",
        "query-filters",
        "ignorequeryfilters"
      ],
      "verification": "verified",
      "usageTier": 1,
      "summary": "A short before/after piece that focuses on the part attendees usually get wrong: selectively disabling one named filter instead of nuking them all with IgnoreQueryFilters. Good hand-out to pair with the lab.",
      "recommended": false
    },
    {
      "id": "nikolatech-complex-types-ef-core-10",
      "title": "Complex Types in EF Core 10",
      "author": "Nikola Knez",
      "publisher": "NikolaTech",
      "url": "https://www.nikolatech.net/blogs/complex-types-ef-core-10",
      "published": "2026-01-08",
      "retrieved": "2026-09-14",
      "origin": "discovered",
      "kind": "article",
      "modules": [
        "day1-m5"
      ],
      "covers": [
        "net10",
        "efcore",
        "efcore10",
        "complex-types",
        "value-objects",
        "owned-entities",
        "structs"
      ],
      "verification": "verified",
      "usageTier": 1,
      "summary": "Covers the complex-type story end to end for EF Core 10 — optional complex types, struct support, JSON mapping and the breaking changes — and explains why value objects should now move off owned entities. Directly supports the complex-vs-owned decision we ask attendees to make.",
      "recommended": false
    },
    {
      "id": "nikolatech-ef-core-vector-similarity-search",
      "title": "Vector Similarity Search in EF Core 10",
      "author": "Nikola Knez",
      "publisher": "NikolaTech",
      "url": "https://www.nikolatech.net/blogs/ef-core-vector-similarity-search",
      "published": "2025-12-25",
      "retrieved": "2026-09-14",
      "origin": "discovered",
      "kind": "article",
      "modules": [
        "day1-m5"
      ],
      "covers": [
        "net10",
        "efcore",
        "efcore10",
        "vector-search",
        "sql-server-2025",
        "vectordistance"
      ],
      "verification": "verified",
      "usageTier": 1,
      "summary": "Runs the new VECTOR column type and VectorDistance translation against SQL Server 2025 from LINQ, with the argument that many teams no longer need a separate vector store. Useful counterweight to the 'just add a vector database' reflex.",
      "recommended": false
    },
    {
      "id": "jaliya-ef-core-11-migrations",
      "title": "EF Core 11.0: What's New with Migrations",
      "author": "Jaliya Udagedara",
      "publisher": "Jaliya's Blog",
      "url": "https://jaliyaudagedara.blogspot.com/2026/09/ef-core-110-whats-new-with-migrations.html",
      "published": "2026-09-11",
      "retrieved": "2026-09-14",
      "origin": "discovered",
      "kind": "article",
      "modules": [
        "day2-m5"
      ],
      "covers": [
        "net11",
        "efcore",
        "efcore11",
        "migrations",
        "dotnet-ef",
        "tooling"
      ],
      "previewDrift": "none",
      "verification": "verified",
      "usageTier": 1,
      "summary": "Written three days after RC 1, so it reflects where the migrations tooling actually landed: the dotnet ef configuration file, -NoBuild for PMC, wildcard context support and the migration ID recorded in the snapshot. The freshest EF Core 11 community writing we found.",
      "recommended": true,
      "writtenAgainst": "Not stated by the author; published 2026-09-11"
    },
    {
      "id": "jaliya-ef-core-11-complex-types-tpt-tpc",
      "title": "EF Core 11.0: Complex Types and JSON Columns on Entity Types with TPT/TPC Inheritance",
      "author": "Jaliya Udagedara",
      "publisher": "Jaliya's Blog",
      "url": "https://jaliyaudagedara.blogspot.com/2026/03/ef-core-110-complex-types-and-json.html",
      "published": "2026-03-01",
      "retrieved": "2026-09-14",
      "origin": "discovered",
      "kind": "article",
      "modules": [
        "day2-m5"
      ],
      "covers": [
        "net11",
        "efcore",
        "efcore11",
        "complex-types",
        "tpt",
        "tpc",
        "json-columns",
        "inheritance"
      ],
      "previewDrift": "minor",
      "driftNote": "Written during the preview cycle. We have not re-run its samples against RC 1, so treat the specific API surface as indicative rather than exact; the modelling capability it describes is still present.",
      "verification": "verified",
      "usageTier": 1,
      "summary": "Demonstrates the EF Core 11 change that finally lets complex types and JSON columns sit on entities mapped with TPT or TPC inheritance — the gap that blocked several EF Core 10 modelling designs. Short, code-first, and easy to lift into a demo.",
      "recommended": false,
      "writtenAgainst": "Not stated by the author; published 2026-03-01"
    },
    {
      "id": "startdebugging-efcore-11-cheat-sheet",
      "title": "EF Core 11 cheat sheet",
      "author": "Marius Bughiu",
      "publisher": "Start Debugging",
      "url": "https://startdebugging.net/pillars/efcore-11-cheat-sheet/",
      "published": "2026-04-18",
      "retrieved": "2026-09-14",
      "origin": "discovered",
      "kind": "article",
      "modules": [
        "day2-m5"
      ],
      "covers": [
        "net11",
        "efcore",
        "efcore11",
        "vector-search",
        "diskann",
        "tph",
        "tpt",
        "tpc",
        "analyzers"
      ],
      "previewDrift": "minor",
      "driftNote": "A living index updated through the preview cycle, so individual entries may lead or lag RC 1. Use it as a map of what to investigate, not as a citation for any single claim.",
      "verification": "verified",
      "usageTier": 1,
      "summary": "A running index of EF Core 11 changes kept up to date through the preview cycle — VECTOR_SEARCH() with DiskANN indexes, inheritance-strategy guidance and the new EF1004 analyzer. Handy as a breadth map before attendees pick what to dig into.",
      "recommended": false,
      "writtenAgainst": "Not stated by the author; published 2026-04-18"
    },
    {
      "id": "dotnet-blog-api-versioning-openapi-net10",
      "title": "Combining API versioning with OpenAPI in .NET 10 applications",
      "author": "Sander ten Brinke",
      "publisher": ".NET Blog (devblogs.microsoft.com)",
      "url": "https://devblogs.microsoft.com/dotnet/api-versioning-in-dotnet-10-applications/",
      "published": "2026-04-28",
      "retrieved": "2026-09-14",
      "origin": "discovered",
      "kind": "article",
      "modules": [
        "day1-m4"
      ],
      "covers": [
        "net10",
        "aspnetcore",
        "openapi",
        "openapi-31",
        "api-versioning",
        "minimal-apis"
      ],
      "verification": "verified",
      "usageTier": 1,